<!ELEMENT RelatedCommands (CommandRelation*)>

<!ELEMENT CommandRelation (MainCommand, Command*)>

<!ELEMENT MainCommand (#PCDATA)>

<!ELEMENT Command (#PCDATA)>

